{
  "dataset_name": "qa-eval-v1",
  "dataset_version": "1",
  "schema_version": "dataset_v1",
  "cases": [
    {
      "id": "parameter_franchise_royalty_rate",
      "tags": ["parameter", "single_fact"],
      "critical": false,
      "question": "What share of their sales do franchisees typically pay the brand owner in royalties?",
      "expected_arm": "full-context",
      "scope": {"episode_id": 1},
      "gold_chunks": null,
      "gold_segments": [{"start": 340.434, "end": 348.801}],
      "reference_answer": "Brian Kalachi says franchisees pay a percentage of their sales as royalties, usually between 6% and 20%. In return they agree to follow the franchisor's instructions.",
      "required_claims": ["Royalties are a percentage of the franchisee's sales", "Usually between 6% and 20%"]
    },
    {
      "id": "temporal_taft_hartley_act",
      "tags": ["temporal", "single_fact"],
      "critical": false,
      "question": "Which anti-labor law did the guest say franchising took off after, and what year was it passed?",
      "expected_arm": "full-context",
      "scope": {"episode_id": 1},
      "gold_chunks": null,
      "gold_segments": [{"start": 2208.064, "end": 2213.626}, {"start": 2221.089, "end": 2224.43}],
      "reference_answer": "The Taft-Hartley Act of 1947. It stops workers from striking against or targeting the McDonald's corporation, so they can only target their immediate employer, and franchising took off after it was passed.",
      "required_claims": ["Taft-Hartley Act", "Passed in 1947", "Franchising took off after it"]
    },
    {
      "id": "parameter_franchise_contracts_coded",
      "tags": ["parameter"],
      "critical": true,
      "question": "How many franchise contracts did Brian Kalachi hand-code for his research, and how long did it take him?",
      "expected_arm": "search",
      "scope": {"podcast_id": 1},
      "gold_chunks": [404],
      "gold_segments": null,
      "reference_answer": "About 10 years ago he read and hand-coded 530 franchise contracts covering hundreds of contract terms. It took him about 18 months, and the result was only a cross-section.",
      "required_claims": ["530 contracts", "About 18 months", "Coded by hand"]
    },
    {
      "id": "long_question_no_poach_washington",
      "tags": ["single_fact", "long_question"],
      "critical": false,
      "question": "The guest mentioned a natural experiment involving a state and McDonald's no-poach agreements. Which state was it, what happened, and what did his research find about wages afterward?",
      "expected_arm": "search",
      "scope": {"podcast_id": 1},
      "gold_chunks": [399, 400],
      "gold_segments": null,
      "reference_answer": "Washington State entered a consent decree with McDonald's and several other chains to get rid of their no-poach agreements. Kalachi's research found a causal effect: once the agreements were removed, wages went up.",
      "required_claims": ["Washington State", "Consent decree removed no-poach agreements at McDonald's and other chains", "Wages went up afterward (causal effect)"]
    },
    {
      "id": "temporal_kakeya_paper_upload",
      "tags": ["temporal", "parameter"],
      "critical": false,
      "question": "王虹和合作者是什么时候上传了证明三维挂谷猜想的论文？那篇论文有多少页？",
      "expected_arm": "full-context",
      "scope": {"episode_id": 2},
      "gold_chunks": null,
      "gold_segments": [
        {"start": 1714.72, "end": 1715.98},
        {"start": 1715.98, "end": 1718.56},
        {"start": 1719.68, "end": 1725.36}
      ],
      "reference_answer": "2025年2月24日，王虹和扎尔（Zahl）上传了一篇127页的论文。论文彻底证明了三维挂谷集合的豪斯多夫维数和闵可夫斯基维数都是3。",
      "required_claims": ["上传时间是2025年2月24日", "论文共127页", "合作者是扎尔（Zahl）", "证明三维挂谷集合的维数都是3"]
    },
    {
      "id": "parameter_express_volume_2025",
      "tags": ["parameter", "multi_hop"],
      "critical": true,
      "question": "2025年全国快递业务量是多少件？业务量增速和业务收入增速分别是多少？",
      "expected_arm": "full-context",
      "scope": {"episode_id": 2},
      "gold_chunks": null,
      "gold_segments": [
        {"start": 4076.51, "end": 4080.66},
        {"start": 4080.66, "end": 4082.52},
        {"start": 4082.92, "end": 4083.7},
        {"start": 4083.86, "end": 4088.02},
        {"start": 4088.04, "end": 4089.22},
        {"start": 4089.48, "end": 4089.72},
        {"start": 4090.02, "end": 4091.32},
        {"start": 4091.56, "end": 4092.7}
      ],
      "reference_answer": "2025年全国快递业务量是1989.5亿件，同比增长13.6%。快递业务收入只增长了6.5%，业务量增长明显快于收入增长，说明单件平均收入在下降。",
      "required_claims": ["2025年快递业务量为1989.5亿件", "业务量同比增长13.6%", "业务收入增长6.5%", "业务量增长快于收入增长"]
    },
    {
      "id": "ambiguity_eight_jiao",
      "tags": ["ambiguity", "definition"],
      "critical": false,
      "question": "节目里说的“八毛钱”指的是什么？",
      "expected_arm": "search",
      "scope": {"podcast_id": 2},
      "gold_chunks": [512, 513],
      "gold_segments": null,
      "reference_answer": "在快递那段里，“八毛钱”有两种意思。一是“八毛发全国”，指2025年整治低价竞争时，部分产粮区出现过一票八毛钱左右的寄件报价，主要面向重量轻、货量特别大的客户。二是末端派送费，一些地区的单票派送收入从早年的一块左右降到了八毛甚至更低。",
      "required_claims": ["一种是“八毛发全国”的低价寄件报价", "这种报价主要面向重量轻、货量大的客户", "另一种是末端单票派送费从约一块降到八毛甚至更低"]
    },
    {
      "id": "parameter_sign_language_dataset_price",
      "tags": ["single_fact", "parameter"],
      "critical": false,
      "question": "在 Mozilla 的数据交易平台上，标价最贵的那套巴西手语医疗视频数据有多长，卖多少钱？",
      "expected_arm": "search",
      "scope": {"podcast_id": 2},
      "gold_chunks": [530],
      "gold_segments": null,
      "reference_answer": "这套巴西手语医疗视频数据时长24.6个小时，标价3.15万美元（31,500美元），是三套数据里最贵的。数据由44名参与者用手语表达疾病症状、医疗术语、心理健康和临床交流等内容。",
      "required_claims": ["时长为24.6小时", "标价3.15万美元", "由44名参与者录制", "挂在 Mozilla Data Collective 平台上"]
    },
    {
      "id": "comparison_toast_payments_take_rate",
      "tags": ["parameter", "comparison"],
      "critical": true,
      "question": "What net take rate does Toast earn on payments, and how does that compare with what most competitors charge?",
      "expected_arm": "full-context",
      "scope": {"episode_id": 3},
      "gold_chunks": null,
      "gold_segments": [
        {"start": 829.693, "end": 834.838},
        {"start": 843.746, "end": 850.292}
      ],
      "reference_answer": "Toast keeps about 49 basis points (roughly 50 cents on a $100 order) as its net payments take rate. Most competitors charge 75 to 125 basis points on a net gross-profit take-rate basis, so Toast is under-monetized relative to the space.",
      "required_claims": ["Toast's net payments take rate is about 49 basis points (about 50 cents per $100 order)", "Most competitors charge about 75 to 125 basis points"]
    },
    {
      "id": "parameter_toast_grow_price",
      "tags": ["single_fact", "parameter"],
      "critical": false,
      "question": "How much does Toast Grow cost restaurants per month, and what revenue uplift have early users seen?",
      "expected_arm": "full-context",
      "scope": {"episode_id": 3},
      "gold_chunks": null,
      "gold_segments": [
        {"start": 1468.346, "end": 1472.211},
        {"start": 1473.412, "end": 1480.634}
      ],
      "reference_answer": "Toast Grow, Toast's automated AI marketing engine, costs about $500 a month. Over its first month or two of use, customers saw about an 8% uplift in total revenue.",
      "required_claims": ["Toast Grow costs about $500 per month", "Early users saw about an 8% uplift in total revenue"]
    },
    {
      "id": "definition_flywheel_market",
      "tags": ["definition"],
      "critical": false,
      "question": "What does Toast's management mean by a 'flywheel market'?",
      "expected_arm": "search",
      "scope": {"podcast_id": 3},
      "gold_chunks": [604],
      "gold_segments": null,
      "reference_answer": "A flywheel market is a city where Toast reaches about 10% market share. At that point network effects take hold, the market standardizes on Toast, and its share gains accelerate rather than slow down.",
      "required_claims": ["A flywheel market is reached when Toast hits about 10% market share in a city/market", "At that point network effects take hold and the market standardizes on Toast", "Market share then accelerates faster"]
    },
    {
      "id": "comparison_toast_vs_doordash",
      "tags": ["comparison", "long_question"],
      "critical": false,
      "question": "DoorDash has been piloting point-of-sale systems with restaurants. How did Toast put pressure on DoorDash's delivery business, and why does the guest think restaurants would not switch from Toast to DoorDash even if its POS were free?",
      "expected_arm": "search",
      "scope": {"podcast_id": 3},
      "gold_chunks": [591, 592],
      "gold_segments": null,
      "reference_answer": "About a year earlier, Toast started offering free delivery to restaurants through its ordering module in partnership with Uber Eats, and about 80,000 restaurants (half its base) have signed up. DoorDash takes a 13–15% delivery take rate, and all-in fees can reach 30% of an order. Switching from Toast to DoorDash would save only about 50 bps on payments in exchange for those much higher delivery fees, so the guest calls it economically irrational.",
      "required_claims": ["Toast began offering free delivery (in partnership with Uber Eats) via its ordering module", "About 80,000 restaurants, roughly half of Toast's base, signed up for the ordering module", "DoorDash charges roughly a 13-15% take rate on deliveries (up to ~30% all-in fees)", "Switching would save only ~50 bps on payments, so the unit economics are non-rational"]
    },
    {
      "id": "definition_taste_virtuous_consumption",
      "tags": ["definition"],
      "critical": false,
      "question": "In his book on taste, how does Ruby Thelot define taste, and when does he say the question of taste first emerged?",
      "expected_arm": "full-context",
      "scope": {"episode_id": 5},
      "gold_chunks": null,
      "gold_segments": [
        {"start": 1050.678, "end": 1061.729},
        {"start": 1062.15, "end": 1066.033},